"","person","message","debate","date"
"1","CRAP","MODERATORS:Charlie Rose (PBS);Karen Tumulty (Washington Post);Juliana Goldman (Bloomberg TV)","2012RHanoverNH",2011-10-11
"9","ROSE","I'm Charlie Rose. Welcome to Dartmouth College in Hanover, New Hampshire, this great college established in 1769 in a state that often plays a crucial role in picking presidents. Tonight, it is the site of an important Republican presidential debate brought to you by Bloomberg, the Washington Post, and WBIN Television.  This is a time of anxiety about our country and our children's future in a continuing economic crisis. Many are in despair, not only about policy, but politics. And so we ask who has the character, who has the ideas, and who has the experience to lead.  This debate is different and distinctive. It is only about the economy. So we debate this evening about spending and taxes, deficit and debt, about the present and the future, about rich and poor, and about the role of government. And because we're at a table -- this is the kind of table I like -- the kind of kitchen table where families for generations have come together to talk and solve their problems.  The rules are one minute for an answer, 30 seconds for follow-up and rebuttal. If a candidate is singled out by name for criticism, they have 30 seconds to respond. Later in the debate, they will question each other.  I'm the moderator. Joining me are Karen Tumulty of the Washington Post and Julianna Goldman of Bloomberg News.  Joining us at the table, the eight Republican candidates. They are: former Governor of Utah Jon Huntsman; Minnesota Congresswoman Michele Bachmann; Texas Governor Rick Perry; former Godfather's Pizza CEO Herman Cain; former U.S. Senator from Pennsylvania Rick Santorum; former Speaker of the House of Representatives Newt Gingrich; Texas Congressman Ron Paul; former Massachusetts Governor Mitt Romney.  I am pleased to be here at this table to have an opportunity to talk to them about the issues that all of us are thinking about.  And I begin this evening first with Herman Cain. As you know, when Standard & Poor's downgraded American credit, they noted not only the economic difficulties, but the political dysfunction. So we begin this evening with the question: What would you do specifically to end the paralysis in Washington? ","2012RHanoverNH",2011-10-11
"12","CAIN","Two things. Present a bold plan to grow this economy, which I have put my 9-9-9 plan on the table, and it starts with throwing out the current tax code and putting in the 9-9-9 plan.  Secondly, get serious about bringing down the national debt. The only way we're going to do that is, the first year that I'm president and I oversee a fiscal year budget, make sure that revenues equals spending. If we stop adding to the national debt, we can bring it down.  So the answer is, we must grow this economy with a bold solution, which is why I have proposed 9-9-9, and at the same time get serious about not creating annual deficits so we can bring down the national debt. That would re-establish confidence in our system, and I believe we could get our credit rating back. ","2012RHanoverNH",2011-10-11
"13","ROSE","Governor Perry, are you prepared -- even though you've said that you want to make Washington inconsequential -- to go to Washington and, as Ronald Reagan did, compromise on spending cuts and taxes in order to produce results? ","2012RHanoverNH",2011-10-11
"15","PERRY","Well, certainly as the governor of the second largest state, I've had to deal with folks on both sides of the aisle. I've signed six balanced budgets as the governor of -- of Texas. So working with folks on both sides of the aisle and -- and bringing ideas, whether it's ways to redo your tax structure or what have you.  One of the things that I laid out today I think is a pretty bold plan, to put 1.2 million Americans working in the energy industry. And you don't need Congress to do that. You need a president with a plan, which I'm laying out over the next three days, and, clearly, the intent to open up this treasure trove that America's sitting on and getting America independent on the domestic energy side. It's time for another American Declaration of Independence. It's time for energy independence. ","2012RHanoverNH",2011-10-11
"16","ROSE","We'll come back to energy, also your economic plan this evening, but I go now to Governor Romney. The paralysis there, and everybody's concerned about it. What specifically would you be prepared to do to make the country moving again on addressing its problems? ","2012RHanoverNH",2011-10-11
"20","ROMNEY","I'd be prepared to be a leader. You can't get the country to go in the right direction and get Washington to work if you don't have a president that's a leader. And three years ago, we selected a person who had never had any leadership experience, never worked in the private sector, never had the opportunity to actually bring people together, and he hasn't been able to do so.  He said he'd bring us hope and change. Instead, he's divided the nation and tried to blame other people.  The real course for America is to have someone who is a leader, who can identify people in both parties who care more about the country than they care about getting reelected.  There are Democrats like that. There are Republicans like that. I was the governor of a state that had a few Democrats. People in this room know how many we had in Massachusetts. ","2012RHanoverNH",2011-10-11
"21","ROSE","So it's essential to deal with Democrats and be prepared to compromise on the big issues of our time? ","2012RHanoverNH",2011-10-11
"23","ROMNEY","You have to stand by your principles. At the same time, you know that good Democrats and good Republicans who love the country first will be able to find common ground from time to time and recognize we can't keep on spending like we're spending, we can't demand more from tax revenue from people, because that kills jobs and hurts working families.  We have got to help the middle class in this country. The only way that will come together is if you have people on both sides of the aisle who listen to a leader who has the experience of leading. And that's what America is looking for and desperately longing for. ","2012RHanoverNH",2011-10-11
"24","ROSE","And back to Governor Perry, this plan that you would like to lay out, because Governor Romney has said you have had two months to produce a plan, an economic plan, he's had a 59 point plan, what is the plan? What will you say specifically? ","2012RHanoverNH",2011-10-11
"26","PERRY","Well, clearly, opening up a lot of the areas of our domestic energy area. That's the real key. You have got an administration that, by and large, has either by intimidation or over-regulation, put our energy industry and the rest of the economy in jeopardy. And we have got to have a president who is willing to stand up and to clearly pull back those regulations that are strangling the American entrepreneurship that's out there.  And it doesn't make any difference whether it's Obamacare, whether it's Dodd-Frank, or whether it's the tax burden. A president, particularly with the plan that I'm going to be laying out over the next three days -- and I'm not going to lay it out all for you tonight -- Mitt has had six years to be working on a plan. I have been in this for about eight weeks. But, clearly, we're going to be focused on initially the energy industry in this country and making a America again independent, and clearly the place where domestic energy needs to be produced from. ","2012RHanoverNH",2011-10-11
"27","ROSE","Let me introduce my friend Karen -- Karen. ","2012RHanoverNH",2011-10-11
"29","TUMULTY","Congresswoman Bachmann, three years after the financial meltdown, Main Street continues to suffer. People have lost their jobs, they've lost their homes, they've lost their faith in the future. But Wall Street is thriving. The banks not only got bailed out by the government, they have made huge profits, they've paid themselves huge bonuses.  Do you think it's right that no Wall Street executives have gone to jail for the damage they did to the economy? ","2012RHanoverNH",2011-10-11
"30","BACHMANN","I think if you look at the problem with the economic meltdown, you can trace it right back to the federal government, because it was the federal government that demanded that banks and mortgage companies lower platinum level lending standards to new lows. ","2012RHanoverNH",2011-10-11
"31","TUMULTY","But the federal government has also deregulated them. ","2012RHanoverNH",2011-10-11
"36","BACHMANN","It was the federal government that pushed the subprime loans. It was the federal government that pushed the Community Reinvestment Act. It was Congressman Barney Frank and also Senator Chris Dodd that continued to push government-directed housing goals.  They pushed the banks to meet these rules. And if banks failed to meet those rules, then the federal government said we won't let you merge, we won't let you grow.  There's a real problem, and it began with the federal government, and it began with Freddie and Fannie. If you look at these secondary mortgage companies which the federal government is essentially backing 100 percent, they put American mortgages in a very difficult place.  We had artificially low interest rates, Freddie and Fannie were the center of the universe on the mortgage meltdown, and we had lending standards lowered for the first time in American history. The fault goes back to the federal government, and that's what's wrong with Dodd- Frank.  Dodd-Frank institutionalized all of these problems that were put into effect by the federal government. That's why I introduced the bill to repeal Dodd-Frank. It's the Jobs and Housing Destruction Act. ","2012RHanoverNH",2011-10-11
"38","TUMULTY","So, Speaker Gingrich, it sounds like Congresswoman Bachmann does not believe that Wall Street is to blame for the financial mess. You've said that the current protests on Wall Street are, in your words, ""the natural product of Obama's class warfare.""  Does this mean that these people who are out there protesting on Wall Street, across the country, have no grievance? ","2012RHanoverNH",2011-10-11
"44","GINGRICH","No, let me draw a distinction. I think there -- virtually every American has a reason to be angry. I think virtually every American has a reason to be worried.  I think the people who are protesting on Wall Street break into two groups. One is left-wing agitators who would be happy to show up next week on any other topic, and the other is sincere middle-class people who, frankly, are very close to the Tea Party people and actually care.  And you can tell which group is which. The people who are decent, responsible citizens pick up after themselves. The people who are just out there as activists trash the place and walk off and are proud of having trashed it. So let's draw that distinction.  If they want to really change things, the first person to fire is Bernanke, who is a disastrous chairman of the Federal Reserve. The second person to fire is Geithner.  The fact is, in both the Bush and the Obama administrations, the fix has been in. And I think it's perfectly reasonable for people to be angry. But let's be clear who put the fix in: The fix was put in by the federal government.  And if you want to put people in jail -- I want to second what Michele said -- you ought to start with Barney Frank and Chris Dodd and let's look at the politicians who created the environment, the politicians who profited from the environment, and the politicians who put this country in trouble. ","2012RHanoverNH",2011-10-11
"45","ROSE","Clearly you're not saying they should go to jail? ","2012RHanoverNH",2011-10-11
"46","GINGRICH","Well, in Chris Dodd's case, go back and look at the countryside [sic] deals. In Barney Frank's case, go back and look at the lobbyists he was close to at -- at Freddie Mac. All I'm saying is... ","2012RHanoverNH",2011-10-11
"47","UNKNOWN","So if he were... ","2012RHanoverNH",2011-10-11
"50","GINGRICH","Everybody -- everybody in the media who wants to go after the business community ought to start by going after the politicians who have been at the heart of the sickness which is weakening this country and ought to start with Bernanke, who has still not been exposed for the hundreds of billions of dollars.  [applause]  And I'm going to say one last thing. I want to repeat this. Bernanke has in secret spent hundreds of billions of dollars bailing out one group and not bailing out another group. I don't see anybody in the news media demanding the kind of transparency at the Fed that you would demand of every other aspect of the federal government. And I think it is corrupt and it is wrong for one man to have that kind of secret power. ","2012RHanoverNH",2011-10-11
"52","TUMULTY","So, Congressman Paul, where you come down on this?  [laughter] ","2012RHanoverNH",2011-10-11
"57","PAUL","One thing I might -- might say is, we have made some inroads on the Federal Reserve. We passed a bill last year. We got a partial, you know, audit of the Fed. We've learned a whole lot. They were dealing in $15 trillion; $5 trillion went overseas to bail out foreign banks.  But you know what? Congress did a lot. I've worked on it for a good many years. But Bloomberg helped and Fox helped. They had court cases, Freedom of Information Act. And there are some even at this table who didn't think auditing the Fed was such a good idea, that we could call up the Fed and ask them and they would tell us what they're doing. I've been calling them up for 30 years and they never tell me.  [laughter]  But we're getting to the bottom of it. But if you want to understand why we have a problem, you have to understand the Fed, because the cause comes from the business cycle. We shouldn't be asking what to do exactly with the recession -- obviously, we have to deal with that -- but you can't solve -- you can't cure the disease if you don't know the cause of it.  And the cause is the booms. When there are booms and they're artificial, whether it's the CRA or whether it's the Fed, easy credit, when you have bubbles, whether it's the Nasdaq or whether it's the housing bubbles, they burst. And when they do, you have to have corrections. And that's what we're dealing with. And we can do this by building coalitions and not sacrificing any principles. ","2012RHanoverNH",2011-10-11
"58","ROSE","Julianna? ","2012RHanoverNH",2011-10-11
"60","GOLDMAN","Thank you, Charlie.  Senator Santorum, I want to turn to jobs, because you've said that when you were growing up in a steel town in Pennsylvania, 21 percent of the country was involved in manufacturing. Now it's down to 9 percent. Can those jobs ever return? And what would you do to create jobs now? ","2012RHanoverNH",2011-10-11
"64","SANTORUM","Yeah, the jobs can come back if you create a climate for them to be profitable. I -- I -- we have a lot of businesspeople, manufacturers in Pennsylvania. I don't know a single one who wanted to shift their jobs offshore, who didn't want them in their own community to be able to employ people and see the fruits of their labor being benefiting the community that they live in.  What happened was, we became uncompetitive. So we need to be competitive. And that's why I've proposed taking the corporate tax for manufacturers and processors, taking it from 35 percent and eliminating it. Zero percent tax. Allow this to be the -- the manufacturing capital of the world again.  Take that money, $1.2 trillion that's overseas from manufacturers who did send their jobs overseas, bring it back, zero percent tax rate if you invest it in plant and equipment in this country.  Repeal every regulation the Obama administration has put in place that's over $100 million. Repeal them all. May have to replace a few. Let's repeal them all, because they're all antagonistic to businesses, particularly in the manufacturing sector, and do as Governor Perry suggested. We need a bold energy plan -- I put one out there -- to drill -- Pennsylvania, I don't want to brag, Governor, but Pennsylvania is the gas capital of the world right now, not Texas, because we are... ","2012RHanoverNH",2011-10-11
"65","ROSE","All right. ","2012RHanoverNH",2011-10-11
"66","SANTORUM","... we're doing a great job. And energy prices and gas went down by 75 percent. ","2012RHanoverNH",2011-10-11
"67","GOLDMAN","Let me just follow up, because we're in a crisis. So what would you do right now to create jobs? ","2012RHanoverNH",2011-10-11
"70","SANTORUM","The cool thing about my plan, as opposed to Herman's plans and some of the other plans out here, it will pass tomorrow. It would pass tomorrow.  Why? Because industrial state Democrats want those jobs. And they know if we put a pro-manufacturing jobs plan on the table, it will pass over night. We'll get votes from Indiana and Pennsylvania and Ohio and Michigan, all of those states.  So, it's not just proposing a plan that will get things started, that ""The Wall Street Journal"" will smile at -- excuse me, ""The Washington Post"" -- but it's a plan that will actually pass and get things done and bring people together. That's why I put it on the table. ","2012RHanoverNH",2011-10-11
"72","GOLDMAN","Thank you.  I want to follow up now to Governor Huntsman. From the Erie Canal to the Internet, innovation is what has always fueled economic recoveries. So shouldn't the focus now not be on trying to create the innovative jobs of tomorrow? And what do you think those are? ","2012RHanoverNH",2011-10-11
"77","HUNTSMAN","We need to regain our industrial base. I would, first and foremost, disagree with Rick on one measure. That is, Pennsylvania is not the gas capital of the country. Washington, D.C., is the gas capital of the country.  [laughter]  There are two things that critically need to be done for us to stay ahead in this highly-competitive world. And when we lose one or both of them, we lose out to the Chinese and the Indians.  One is maintaining a strong commitment to innovation entrepreneurship and freedom in the marketplace. We have the sense of innovation that no country has been able to replicate. Some have tried, and some will continue to try, but nobody does it like we do here, and that gives rise to high technology, to regular manufacturing jobs across the board. It makes this economy hum when it's working well.  The second part of it is, you need a marketplace like Rick described a moment ago in which you can translate those innovations into products. We are losing our ability to maintain a competitive marketplace today. ","2012RHanoverNH",2011-10-11
"78","ROSE","All right. ","2012RHanoverNH",2011-10-11
"79","HUNTSMAN","That's taxes, that's regulation. We have lost it to others. So, right now, we are not able to translate innovation to the -- we've got to regain the magic of a strong marketplace so that we have the complete package. ","2012RHanoverNH",2011-10-11
"80","ROSE","Karen. ","2012RHanoverNH",2011-10-11
"82","TUMULTY","Congressman Gingrich -- Speaker Gingrich, Medicare is going broke. Consider the fact that half of all Medicare spending is done in the last two years of life, and research that has been done right here at Dartmouth by ""The Dartmouth Atlas"" would suggest that much of this money is going to treatments and interventions that do nothing to prolong life or to improve it. In fact, some of it does the opposite.  Do you consider this wasteful spending? And, if so, should the government do anything about it? ","2012RHanoverNH",2011-10-11
"86","GINGRICH","I am really glad you asked that, because I was just swapping e-mails today with Andy von Eschenbach, who was the head of the National Cancer Institute, the head of the Food & Drug Administration. But before that, he was the provost M.D. Anderson, the largest cancer treatment center in the world.  And he wrote me to point out that the most recent U.S. government intervention on whether or not to have prostate testing is basically going to kill people. So, if you ask me, do I want some Washington bureaucrat to create a class action decision which affects every American's last two years of life, not ever.  I think it is a disaster. I think, candidly, Governor Palin got attacked unfairly for describing what would, in effect, be death panels.  And what Von Eschenbach will tell you if you call him is, the decision to suggest that we not test men with PSA will mean that a number of people who do not have -- who are susceptible to a very rapid prostate cancer will die unnecessarily. And there was not a single urologist, not a single specialist on the board that looked at it. So, I am opposed to class intervention for these things. ","2012RHanoverNH",2011-10-11
"87","TUMULTY","Well, Congresswoman Bachmann, of course no one wants the government to come between a doctor and a patient. But do you think that Americans are getting the most for their money in Medicare spending? And how can we make sure that the money that is being spent is being spent on the treatments and the preventive treatments that do the most? ","2012RHanoverNH",2011-10-11
"91","BACHMANN","We have a big problem today when it comes to Medicare, because we know that nine years from now, the Medicare hospital Part B trust fund is going to be dead-flat broke, so we've got to deal with this issue. I was in the White House with President Obama this summer. We asked him not once, but three times, ""President Obama, what is your plan to save Medicare?""  And the president mumbled and he didn't give an answer the first time, the second time. And the third time the president said something very interesting, Karen. He said Obamacare.  I think that senior citizens across the country have no idea that President Obama plans for Medicare to collapse, and instead everyone will be pushed into Obamacare.  And just like Newt Gingrich said, the way that Obamacare runs, there's a board called IPAB. It's made up of 15 political appointees. These 15 political appointees will make all the major health care decisions for over 300 million Americans. I don't want 15 political appointees to make a health care decision for a beautiful, fragile 85- year-old woman who should be making her own decision. ","2012RHanoverNH",2011-10-11
"93","ROSE","We'll come back to Medicare, as well, and medical issues and then the cost of Medicare in the United States.  I want to talk about advisers and appointees. Tell me, Governor Huntsman, whose advice do you seek on economic issues? And who -- what's the profile of the kind of person you'd like to have advising you in your White House? ","2012RHanoverNH",2011-10-11
"97","HUNTSMAN","I'd like the profile of my own father, who's a great entrepreneur. And he started with nothing, and he built a great business. And my brother now runs that business.  People who have been out in the world, who have actually had their hands on products and manufacturing and know something how to build something from the ground up, that's what this country has always done. It's what we need to continue to do.  But in order to have the right policies in place -- and some I've put forward as governor of the great state of Utah -- tax reform. I created a flat tax in the state of Utah. It took that state to the number-one position in terms of job creation. Regulatory reform and energy independence, I want the kind of people who understand what makes an economy work. But let's be real about what it takes to get into federal government service these days. Who on Earth from the private sector is ever going to want to give up their privacy and enter government service with the background checks, the financial disclosures, and everything else that serve as tremendous disincentives for good people to get into government?  So what we have today, Charlie, we've got a professional governing class of people on one end and then you've got private- sector people on the other. ","2012RHanoverNH",2011-10-11
"98","ROSE","And so what would you do about that to change that, to attract those kind of people so that they would be willing to serve a cross-section of people from every gender... ","2012RHanoverNH",2011-10-11
"99","HUNTSMAN","Let's get back to what we did a generation or two ago, when we were more open in terms of accommodating people from all backgrounds who wanted to take a little bit of their life and serve in government, and then leave, and go back to what it is they did best, whether on the farm, or whether insurance, or whether business, or whether academia. ","2012RHanoverNH",2011-10-11
"100","ROSE","When you mention a flat tax, does that mean that you look with some favor upon 9-9-9 that Herman Cain mentioned at the beginning of this conversation? ","2012RHanoverNH",2011-10-11
"102","HUNTSMAN","I think it's a catchy phrase. In fact, I thought it was the price of a pizza when I first heard about it.  [laughter] ","2012RHanoverNH",2011-10-11
"103","ROSE","Price of a pizza? ","2012RHanoverNH",2011-10-11
"105","HUNTSMAN","Well, here's -- here's -- here's what -- here's what we need. We need something that's doable, doable, doable. And what I have put forward is a tax program that is doable. It actually wipes clean all of the loopholes and the deductions.  This is right out of what the Simpson-Bowles Commission recommended, a bipartisan group of people that took a thoughtful approach to tax reform. ","2012RHanoverNH",2011-10-11
"106","ROSE","Corporate and individual? ","2012RHanoverNH",2011-10-11
