"","person","message","debate","date"
"107","HUNTSMAN","Individual, and on the corporate side, phase out all of the corporate welfare, all of the subsidies, because we can't afford it any longer, in a revenue-neutral fashion, buy down the rate from 35 percent to 25 percent, leveling the playing field for businesses big and small, allowing us to be a whole lot more competitive in the second decade of the 21st century. ","2012RHanoverNH",2011-10-11
"108","ROSE","Julianna? ","2012RHanoverNH",2011-10-11
"109","GOLDMAN","OK. We will be coming back to 9-9-9, but first... ","2012RHanoverNH",2011-10-11
"110","CAIN","Wait, wait. ","2012RHanoverNH",2011-10-11
"111","GOLDMAN","Well... ","2012RHanoverNH",2011-10-11
"112","CAIN","He mentioned me. ","2012RHanoverNH",2011-10-11
"113","ROSE","Give him 30 seconds. ","2012RHanoverNH",2011-10-11
"114","CAIN","He mentioned me, and you didn't give me an opportunity to respond. ","2012RHanoverNH",2011-10-11
"115","ROSE","You have that opportunity now. ","2012RHanoverNH",2011-10-11
"116","CAIN","I thank you very much. 9-9-9 will pass, and it is not the price of a pizza, because it has been well-studied and well-developed. It starts with, unlike your proposals, throwing out the current tax code. Continuing to pivot off the current tax code is not going to boost this economy. This is why we developed 9-9-9, 9 percent corporate business flat tax, 9 percent personal income flat tax, and a 9 percent national sales tax. And it will pass, Senator, because the American people want it to pass. ","2012RHanoverNH",2011-10-11
"118","ROSE","This is beginning to sound more like my table.  Julianna? I mean, Karen? ","2012RHanoverNH",2011-10-11
"119","TUMULTY","So, Mr. Cain, who do you turn to for political advice and for economic advice? ","2012RHanoverNH",2011-10-11
"121","CAIN","My advisers come from the American people. Now, I will have some experts. One of my experts that helped me to develop this is a gentleman by the name of Rich Lowery out of Cleveland, Ohio. He is an economist, and he has worked in the business of wealth creation most of his career.  I also have a number of other well-recognized economists that helped me to develop this 9-9-9 plan. It didn't come off a pizza box, no. It was well-studied and well-developed, because it will replace the corporate income tax, the personal income tax, the capital gains tax, the death tax, and most importantly, the payroll tax. ","2012RHanoverNH",2011-10-11
"122","TUMULTY","So -- so who are some of these economists? ","2012RHanoverNH",2011-10-11
"123","CAIN","Rich Lowery out of Cleveland, Texas, is one of the economists that I have used. He's been my lead economist on helping to develop this. ","2012RHanoverNH",2011-10-11
"124","ROSE","Julianna? ","2012RHanoverNH",2011-10-11
"127","GOLDMAN","Thank you.  Governor Romney, it's 2013, and the European debt crisis has worsened. Countries are defaulting. Europe's largest banks are on the verge of bankruptcy. Contagion has spread to the U.S. And the global financial system is on the brink.  What would you do differently than what President Bush, Henry Paulson, and Ben Bernanke did in 2008? ","2012RHanoverNH",2011-10-11
"128","ROMNEY","Well, you're talking about a scenario that's obviously very difficult to imagine. And -- ","2012RHanoverNH",2011-10-11
"129","GOLDMAN","But it's not a hypothetical, because more than half -- ","2012RHanoverNH",2011-10-11
"130","ROMNEY","It is. I'm afraid it is a hypothetical. ","2012RHanoverNH",2011-10-11
"131","GOLDMAN","Governor, it's not -- ","2012RHanoverNH",2011-10-11
"132","ROMNEY","Do you want to explain why it's not a hypothetical? ","2012RHanoverNH",2011-10-11
"133","GOLDMAN","Yes. ","2012RHanoverNH",2011-10-11
"134","ROMNEY","OK. ","2012RHanoverNH",2011-10-11
"135","GOLDMAN","Because more than half the country believes that a financial meltdown is likely in the next several years, and the U.S. banks have at least $700 billion in exposure to Europe. So it's a very real threat, and voters want to know what you would do differently. ","2012RHanoverNH",2011-10-11
"139","ROMNEY","It's still a hypothetical as to what's going to precisely happen in the future. I'm not very good at being omniscient, but I can tell you this, that I am not going to have to call up Timothy Geithner and say, how does the economy work? Because I spent my life in the economy.  I spent my entire career working in the private sector, starting businesses, helping turn around businesses, sometimes successfully and sometimes not. And I know how to make tough decisions and to gather the input from around the country to help make the important decisions that have to be made.  Clearly, if you think the entire financial system is going to collapse, you take action to keep that from happening. In the case of Europe right now, they are looking at what's happening with Greece. Are they going to default on their debt, are they not? That's a decision which I would I would like to have input on if I were president of the United States and try and prevent the kind of contagion that would affect the U.S. banking system and put as at risk.  But I can tell you this -- I'm not interested in bailing out individual institutions that have wealthy people that want to make sure that their shares are worth something. I am interested in making sure that we preserve our financial system, our currency, the banks across the entire country. And I will always put the interest of the American people ahead of the interest of any institution. ","2012RHanoverNH",2011-10-11
"140","GOLDMAN","So would you or would you not be open to another Wall Street bailout? ","2012RHanoverNH",2011-10-11
"141","ROMNEY","No one likes the idea of a Wall Street bailout. I certainly don't. ","2012RHanoverNH",2011-10-11
"143","GOLDMAN","But you said in 2008 that it prevented the collapse of the financial --  [crosstalk] ","2012RHanoverNH",2011-10-11
"147","ROMNEY","There is no question but that the action of President Bush and that Secretary Paulson took was designed to keep not just a collapse of individual banking institutions, but to keep the entire currency of the country worth something and to keep all the banks from closing, and to make sure we didn't all lose our jobs. My experience tells me that we were on the precipice, and we could have had a complete meltdown of our entire financial system, wiping out all the savings of the American people. So action had to be taken.  Was it perfect? No. Was it well implemented? No, not particularly.  Were there some institutions that should not have been bailed out? Absolutely.  Should they have used the funds to bail out General Motors and Chrysler? No, that was the wrong source for that funding. But this approach of saying, look, we're going to have to preserve our currency and maintain America -- and our financial system is essential. ","2012RHanoverNH",2011-10-11
"148","ROSE","So do you agree with Speaker Gingrich about Ben Bernanke, the chairman of the Fed? ","2012RHanoverNH",2011-10-11
"149","ROMNEY","I wouldn't keep Ben Bernanke in office. I would choose someone of my own -- ","2012RHanoverNH",2011-10-11
"150","ROSE","And who might that be? ","2012RHanoverNH",2011-10-11
"152","ROMNEY","Well, I haven't chosen that person. I haven't even chosen a vice president. I'm not sure I'm the nominee yet.  [laughter] ","2012RHanoverNH",2011-10-11
"153","ROSE","Well, we would like to have -- nor has anyone else, but we would like to have an idea of the kind of people that you would have confidence in, in playing this very important role, although Congressman Paul may differ about how important it is. ","2012RHanoverNH",2011-10-11
"155","ROMNEY","Well, I wish we could find Milton Friedman again, although what Milton said to us was -- he said, you know, ""If you took all the economists in America, and you laid them end to end, it would be a good thing."" And I have more respect for economists than that.  The people who help guide my economic policy are Greg Mankiw at Harvard -- ","2012RHanoverNH",2011-10-11
"156","ROSE","Right. ","2012RHanoverNH",2011-10-11
"159","ROMNEY","-- and Glenn Hutchins at Columbia. They were both former chairs of the Council of Economic Advisers. And I didn't always agree with them.  I also talk to a number of business leaders. I talked to people who are currently in the economy, in the financial sector, and in the manufacturing sector. And on the basis of these various viewpoints, I make my decisions. And I believe that drawing on the best minds of this country, including economists, is something that's essential to make sure that we preserve our financial system.  Right now, America is in crisis. We don't need to think about a hypothetical of what happens if Europe explodes and pulls us under, although if that does happen, you want to have someone who is smart, who has experience, who knows how the financial services sector works, who knows how to protect American jobs, and I do. I have done it. ","2012RHanoverNH",2011-10-11
"160","ROSE","And as far as you're concerned, there is no institution, no financial institution, that is too big to fail? ","2012RHanoverNH",2011-10-11
"163","ROMNEY","Well, no. You don't want to bail out anybody.  The idea of trying to bail out an institution to protect the shareholders or to protect a certain interest group, that's a terrible idea. And that shouldn't happen.  You do want to make sure that we don't lose the country and we don't lose our financial system and we don't lose American jobs, and that all the banks don't go under. So, you have to take action very carefully to make sure that you preserve our currency and preserve our financial system. But bailouts of individual institutions? No one has interest in that, I don't think. ","2012RHanoverNH",2011-10-11
"164","GOLDMAN","Mr. Cain, back in 2008, you wrote that the Wall Street bailout was a win-win for the taxpayer. You just heard Governor Romney. Do you agree? ","2012RHanoverNH",2011-10-11
"165","CAIN","Conceptually I made that statement based upon the concept, but I happen to agree with Governor Romney. The way it was administered is where it got off-track. They were discretionary in which institutions they were going to save, rather than apply it equitably, which is what most of us thought was going to be done. The implementation of it is where they got off-track. I didn't agree with it. I don't think Governor Romney agreed with it. So did a lot of us. The implementation was at fault. ","2012RHanoverNH",2011-10-11
"166","ROSE","Housing is considered one of the real problems, in terms of our economy, and getting housing starts up. ","2012RHanoverNH",2011-10-11
"167","GINGRICH","Can I say one thing, before we go to housing? ","2012RHanoverNH",2011-10-11
"168","ROSE","Yes. ","2012RHanoverNH",2011-10-11
"170","GINGRICH","Because I think this is really important. There's a real possibility that you can't have the euro and the Greek economy in the same system. There's a possibility we could have a meltdown in the next year.  The thing that is most obvious looking back is that Paulson and -- and Bernanke and Geithner didn't have a clue, not because they're not smart, but because they were operating in a world that had suddenly changed so radically they didn't know. ","2012RHanoverNH",2011-10-11
"171","ROSE","All right. ","2012RHanoverNH",2011-10-11
"172","GINGRICH","One of the reasons I've said that the Congress should insist that every decision document from 2008, 2009 and 2010 at the Fed be released is we are not any better prepared today for a crisis of that scale because the people who were in that crisis and were wrong are still in charge. And I think we need to learn, what did they do right and what did they do learn -- wrong, precisely for the reason you raised about 2013? ","2012RHanoverNH",2011-10-11
"173","ROSE","Let me go to housing, what you'd do. Would you get the federal government out of housing? Yes? ","2012RHanoverNH",2011-10-11
"174","PAUL","Absolutely. I mean, there's no need to. Look at... ","2012RHanoverNH",2011-10-11
"175","ROSE","No Freddie -- no Freddie Mac, no Fannie Mae, nothing? ","2012RHanoverNH",2011-10-11
"181","PAUL","The -- no. You -- that's where the distortions come. That's where the moral hazard comes from. That's where the malinvestment, overbuild.  It was predictable. You talked about what economists we should look to. And, unfortunately, we've been living with Keynesian economics for many, many decades. And everybody who was right about predicting the bubbles were Austrian economists. They said they were coming. And yet they're also saying -- and I agree with them -- that everything that we're doing right now is wrong.  So what we did with the housing bubble, yes, we had too many houses. It was glaring in our face. The bubble was doomed to burst, and it came because of Fannie Mae, Freddie Mac, easy credit, and also Community Reinvestment Act.  So who -- who got into trouble? The people who did the speculating, the Wall Street, the derivatives market? They got the bailout. They got [inaudible] so what happened to the middle class? They lost their jobs. They lost their houses.  This whole system is all messed up. And you're -- what I hear here is just tinkering with the current system and not looking at something new and different, and it's a free-market economy without a Federal Reserve system, with sound money. If you don't have that, you're going to continue with the bubble.  And this propping up this debt and keeping the correction, you need the correction. You need to get rid of the malinvestment and the debt. ","2012RHanoverNH",2011-10-11
"182","ROSE","All right. Time. ","2012RHanoverNH",2011-10-11
"183","PAUL","The debt is the burden on the economy. ","2012RHanoverNH",2011-10-11
"188","ROSE","All right. We'll be back -- take a break and be right back. Stay with us from Dartmouth, Hanover, New Hampshire.  [commercial break] In order to take the pulse of America, we have partnered with LinkedIn. And they have some hundred 120 billion network professionals. And we've asked them to take part of this by giving us some polling that they have done.  But before I bring some of those results in, I want to take a look at a series of clips we'll show you in this segment, beginning with this one of a former president.  [begin video clip]","2012RHanoverNH",2011-10-11
"190","STATES","RONALD REAGAN, 40TH PRESIDENT OF THE UNITED The single most important question facing us tonight is, do we reduce deficits and interest rates by raising revenue from those who are not now paying their fair share? Or do we accept a bigger budget deficits, higher interest rates, and higher unemployment simply because we disagree on certain features of a legislative package which offers hope for millions of Americans at home, on the farm, and in the workplace?  [end video clip]","2012RHanoverNH",2011-10-11
"191","ROSE","Let me go to the governor of Texas. Do you agree with the former president? ","2012RHanoverNH",2011-10-11
"194","PERRY","Well, I think we are certainly talking about different times, because what I heard him say there, that he was willing to trade tax increases for reductions. And I don't think he ever saw those reductions, he just saw the tax increase. As a matter of fact, in his diary, he made that statement that he is still looking around for those reductions.  So, I mean, from the standpoint -- that is one of the problems that we have got in Washington, D.C. One of the reasons that I think Americans are so untrustworthy of what is going on in Washington is because they never see a cut in spending. They always hear the siren song of, you know, if you will allow us to raise taxes, then we'll make these reductions over here.  When the fact of the matter is, the issue is we need to have a balanced budget amendment to the United States Constitution. And the next president of the United States needs to spend his time passing a balanced budget amendment to the United States Constitution. ","2012RHanoverNH",2011-10-11
"196","ROSE","But I want to stay with this idea of spending cuts and revenue increases. And go back to you, Governor Romney. This is where it is, it seems, in Washington right now. Not only the paralysis, but also you have got the super committees. And if, in fact, they can't find an agreement, you are going to have a trigger with automatic cuts, including defense.  So doesn't that demand some kind of compromise, as Reagan suggested? ","2012RHanoverNH",2011-10-11
"199","ROMNEY","Well, I don't know which particular compromises he was referring to, we could take a look at that. But I can tell you this, if you go back a few years before that clip and go to JFK's time, the government at all levels, federal, state, and local, was consuming about 27 percent of the U.S. economy. Today it consumes about 37 percent of the U.S. economy. It is on track to get to 40 percent.  We cease, at some point, to be a free economy. And the idea of saying, we just want a little more, just give us some more tax revenue, we need that. That is not the answer for America. The answer is to cut federal spending. The answer is to cap how much the federal government can as a percentage of our economy and have a balanced budget amendment.  And the second part of the answer is to get our economy to grow, because the idea of just cutting and cutting and taxing more -- I understand mathematically those things work, but nothing works as well as getting the economy going. Get Americans back to work. Get them paying taxes. Get -- get corporations growing in America, investing in America. Bring dollars back, as Rick said, repatriation dollars. Bring $1.3 trillion back from overseas. Invest in the United States. Get this economy going, and I'll tell you, these kinds of problems will disappear. ","2012RHanoverNH",2011-10-11
"200","TUMULTY","But could we get back to the actual choice that is likely to confront Congress at the end of the year, which is some mix of revenues and cuts or these draconian automatic spending cuts that would include defense, which of those two, if that is the choice, would you prefer? ","2012RHanoverNH",2011-10-11
"201","ROMNEY","Well, my choice is not to cut defense. I think it's a terrible idea to cut defense. I think it's a terrible idea to raise taxes. Particularly at a time when the economy's struggling, the idea of raising taxes, taking more money away from the American people so government can spend it, and can spend it -- right now, the president has a jobs bill. ","2012RHanoverNH",2011-10-11
"202","TUMULTY","So this is... ","2012RHanoverNH",2011-10-11
"203","ROMNEY","How'd his last jobs bill work out for us? ","2012RHanoverNH",2011-10-11
"204","TUMULTY","But this is automatic cuts? ","2012RHanoverNH",2011-10-11
"208","ROMNEY","Not so well.  [crosstalk]  No, I do not want the automatic cuts. I want to see that super-committee take responsibility for getting the economy going again by reining in the scale of the federal government and saying we're going to pull back on some of the programs we have and reform our entitlements so they're sustainable.  The American people want to see growth and jobs, and they believe that the right way to do it is by cutting back on the scale of government, and they're right. ","2012RHanoverNH",2011-10-11
"211","ROSE","Without any increase in revenue?  [applause]  [crosstalk] ","2012RHanoverNH",2011-10-11
"216","GINGRICH","I just want to say -- I want to say one thing about the entire way Washington works, which was just posed in that question. First of all, the Congress couldn't figure out how to get the debt ceiling done with a president who showed zero leadership, so they adopt a truly stupid bill, OK?  [laughter]  And the bill basically says, we're either going to shoot ourselves in the head or cut off our right leg, and we'll come in around Thanksgiving and we'll show you how we're going to cut off the right leg, and the alternative will be shooting ourselves in the head.  Let me just say it bluntly. All of the spending cuts that are built into the debt ceiling bill, all of them are acts of Congress. They can all be repealed at any moment. It is nonsense to say we're going to disarm the United States unilaterally because we're too stupid to balance the budget any other way.  [applause] ","2012RHanoverNH",2011-10-11
"218","ROSE","All right.  Congresswoman Bachmann? ","2012RHanoverNH",2011-10-11
"221","BACHMANN","Charlie, last summer I was a leading voice in the wilderness of Washington and a lone voice, as a matter of fact, saying: Do not increase the debt ceiling. By that, what I was saying is, let's not give Barack Obama another $2.4 trillion blank check to spend.  Think of what this means. Our government right now -- this is significant -- we are spending 40 percent more than what we take in. We all paid a lot of taxes this year. We paid $2.2 trillion in taxes. That's a lot of money from all the American people. The American government spent 100 percent of that $2.2 trillion, but the travesty is they spent $1.5 trillion more than that. That's the problem.  Every year, we are spending about 40 percent more than what we take in. Our answer has to be that we cut back on the spending so we get to balance. We can't do this because all... ","2012RHanoverNH",2011-10-11
"222","ROSE","Will cutting back on the spending... ","2012RHanoverNH",2011-10-11
"224","BACHMANN","... all around us are young people that are going to be paying for this burden. And their tax rates won't be our tax rates. Their tax rates could come at some point.  Their overall effective burden -- I'm a federal tax lawyer. That's what I do for a living. And my -- my background is in economics. Their tax rate someday in their peak earning years, Charlie, could be as much as 75 percent. Who's going to get out of bed in the morning to go to work if they're paying 75 percent tax rates? We've got to get our spending house in order and cut back on spending. ","2012RHanoverNH",2011-10-11
"225","ROSE","Cutting back on spending, in your judgment, will do it? ","2012RHanoverNH",2011-10-11
"226","BACHMANN","That's one piece of the answer. That's not the whole answer. But we have to cut back on spending. ","2012RHanoverNH",2011-10-11
"228","ROSE","Take -- I want you to take a look. We'll come to all of you. Let me take a look at another clip. This one you will recognize, as well. Here it is.  [begin video clip]","2012RHanoverNH",2011-10-11
"232","CAIN","It's called the 9-9-9 plan.  [applause]  It imposes a 9 percent business flat tax, a 9 percent personal flat tax, and a 9 percent national sales tax.  [end video clip]","2012RHanoverNH",2011-10-11
"233","ROSE","Julianna? ","2012RHanoverNH",2011-10-11
"235","GOLDMAN","I said we would get back to 9-9-9.  Mr. Cain, you say that your plan is revenue-neutral. And last year, the U.S. collected $2.2 trillion dollars in tax revenue, but Bloomberg Government has run the numbers, and your plan would have raised no more than $2 trillion. And even with that shortfall, you'd still be slapping a 9 percent sales tax on food and medicine. ","2012RHanoverNH",2011-10-11
"241","CAIN","The problem with that analysis is that it is incorrect.  [laughter]  [applause]  The reason it is incorrect is because they start with the assumptions that we don't make. Remember, 999 plan throws out the current tax code. And it starts with three simple economic driving principles: production drives the economy, risk-taking drives growth, and we need sound money, measurements must be dependable.  Now what 999 does, it expands the base. When you expand the base, we can arrive at the lowest possible rate which is 999. The difference between the 999 plan and the other plans that are being proposed is that they pivot off of the existing tax code.  We have had an outside firm, independent firm dynamically score it. And so our numbers will make it revenue neutral. ","2012RHanoverNH",2011-10-11
"242","ROSE","All right -- go ahead, I'm sorry, go ahead. ","2012RHanoverNH",2011-10-11
"243","GOLDMAN","But then explain why under your plan all Americans should be paying more for milk, for a loaf of bread, and beer? ","2012RHanoverNH",2011-10-11
"245","CAIN","Pizza, I don't buy beer.  [laughter] ","2012RHanoverNH",2011-10-11
"246","GOLDMAN","Yes, and pizza. ","2012RHanoverNH",2011-10-11
"247","CAIN","You have to start with the biggest tax cut a lot of Americans pay, which is the payroll tax, 15.3 percent. That goes to 9 percent. That is a 6 percentage point difference. And the prices will not go up. So they have got a 6 percentage point difference to apply to the national sales tax piece of that, and in doing so, they have the flexibility to decide on how much they want to spend it on new goods, how much they want to spend it on used goods. Because there is no tax on used goods. ","2012RHanoverNH",2011-10-11
"248","GOLDMAN","But, Congresswoman Bachmann, you're a former IRS lawyer, do you agree? ","2012RHanoverNH",2011-10-11
"253","BACHMANN","I would have to say that the 999 plan isn't a jobs plan, it is a tax plan. And I would say that from my experience being in Congress, but also as a federal tax lawyer, when you -- the last thing you would do is give Congress another pipeline of a revenue stream. And this gives Congress a pipeline in a sales tax.  A sales tax can also lead to value-added tax. The United States Congress put into place the Spanish-American War tax in 1888. We only partially repealed that in 2006. So once you get a new revenue stream, you are never going to get rid of it.  And one thing I would say is, when you take the 999 plan and you turn it upside down, I think the devil is in the details.  [laughter]  [crosstalk] ","2012RHanoverNH",2011-10-11
